{
  "$schema": "https://json-schema.org/draft/2020-12/schema",
  "$id": "https://vc4qi.example/schemas/rm/1/certificate.json",
  "title": "RM certificate (D)",
  "description": "Experimental VC4QI RM binding v1 fixture schema. Not an external standard.",
  "type": "object",
  "required": [
    "@context",
    "id",
    "type",
    "issuer",
    "validFrom",
    "validUntil",
    "credentialSchema",
    "credentialSubject",
    "credentialStatus",
    "relatedResource"
  ],
  "properties": {
    "@context": {
      "const": [
        "https://www.w3.org/ns/credentials/v2",
        "https://vc4qi.example/contexts/rm/1"
      ]
    },
    "id": {
      "type": "string",
      "format": "uri"
    },
    "type": {
      "const": [
        "VerifiableCredential",
        "RmCertificate"
      ]
    },
    "issuer": {
      "type": "string",
      "format": "uri"
    },
    "validFrom": {
      "type": "string",
      "pattern": "^\\d{4}-\\d{2}-\\d{2}T\\d{2}:\\d{2}:\\d{2}(\\.\\d{1,9})?(Z|[+-]\\d{2}:\\d{2})$"
    },
    "validUntil": {
      "type": "string",
      "pattern": "^\\d{4}-\\d{2}-\\d{2}T\\d{2}:\\d{2}:\\d{2}(\\.\\d{1,9})?(Z|[+-]\\d{2}:\\d{2})$"
    },
    "credentialSchema": {
      "type": "object",
      "required": [
        "id",
        "type"
      ],
      "properties": {
        "id": {
          "const": "https://vc4qi.example/schemas/rm/1/certificate.json"
        },
        "type": {
          "const": "JsonSchema"
        }
      },
      "additionalProperties": false
    },
    "credentialSubject": {
      "type": "object",
      "required": [
        "id",
        "activityTime",
        "materials",
        "materialPropertiesList"
      ],
      "properties": {
        "id": {
          "type": "string",
          "format": "uri"
        },
        "activityTime": {
          "type": "string",
          "pattern": "^\\d{4}-\\d{2}-\\d{2}T\\d{2}:\\d{2}:\\d{2}(\\.\\d{1,9})?(Z|[+-]\\d{2}:\\d{2})$"
        },
        "materials": {
          "type": "array",
          "minItems": 1,
          "maxItems": 1,
          "items": {
            "type": "object",
            "required": [
              "matrixIri",
              "formIri"
            ],
            "properties": {
              "matrixIri": {
                "type": "string",
                "format": "uri"
              },
              "formIri": {
                "type": "string",
                "format": "uri"
              },
              "name": {
                "type": "string",
                "minLength": 1
              }
            },
            "additionalProperties": false
          }
        },
        "materialPropertiesList": {
          "type": "array",
          "minItems": 1,
          "items": {
            "type": "object",
            "required": [
              "isCertified",
              "results"
            ],
            "properties": {
              "isCertified": {
                "type": "boolean"
              },
              "results": {
                "type": "array",
                "minItems": 1,
                "items": {
                  "type": "object",
                  "required": [
                    "propertyIri",
                    "methodIri",
                    "data"
                  ],
                  "properties": {
                    "propertyIri": {
                      "type": "string",
                      "format": "uri"
                    },
                    "methodIri": {
                      "type": "string",
                      "format": "uri"
                    },
                    "data": {
                      "type": "object",
                      "required": [
                        "quantity"
                      ],
                      "properties": {
                        "quantity": {
                          "type": "object",
                          "required": [
                            "quantityKind",
                            "value",
                            "unit",
                            "uncertainty"
                          ],
                          "properties": {
                            "quantityKind": {
                              "type": "string",
                              "format": "uri"
                            },
                            "value": {
                              "type": "string",
                              "pattern": "^(0|[1-9][0-9]*)(\\.[0-9]+)?$"
                            },
                            "unit": {
                              "type": "object",
                              "required": [
                                "ucumCode"
                              ],
                              "properties": {
                                "ucumCode": {
                                  "enum": [
                                    "mg/kg",
                                    "kg/kg",
                                    "%"
                                  ]
                                }
                              },
                              "additionalProperties": false
                            },
                            "uncertainty": {
                              "type": "object",
                              "required": [
                                "expandedUncertainty",
                                "coverageFactor"
                              ],
                              "properties": {
                                "expandedUncertainty": {
                                  "type": "string",
                                  "pattern": "^(0|[1-9][0-9]*)(\\.[0-9]+)?$"
                                },
                                "coverageFactor": {
                                  "type": "string",
                                  "pattern": "^(0|[1-9][0-9]*)(\\.[0-9]+)?$"
                                }
                              },
                              "additionalProperties": false
                            }
                          },
                          "additionalProperties": false
                        }
                      },
                      "additionalProperties": false
                    }
                  },
                  "additionalProperties": false
                }
              }
            },
            "additionalProperties": false
          }
        }
      },
      "additionalProperties": false
    },
    "termsOfUse": {
      "type": "array",
      "minItems": 1,
      "maxItems": 4,
      "items": {
        "type": "object",
        "required": [
          "type",
          "authorizationCredential"
        ],
        "properties": {
          "type": {
            "const": "RmAuthorizationPolicy"
          },
          "authorizationCredential": {
            "type": "object",
            "required": [
              "id",
              "type"
            ],
            "properties": {
              "id": {
                "type": "string",
                "format": "uri"
              },
              "type": {
                "enum": [
                  "RmAccreditation",
                  "RmOperationalScope",
                  "RmLabAuthority"
                ]
              }
            },
            "additionalProperties": false
          }
        },
        "additionalProperties": false
      }
    },
    "evidence": {
      "type": "array",
      "minItems": 1,
      "uniqueItems": true,
      "items": {
        "type": "object",
        "required": [
          "id",
          "type"
        ],
        "properties": {
          "id": {
            "type": "string",
            "format": "uri"
          },
          "type": {
            "const": "RmStudyReference"
          }
        },
        "additionalProperties": false
      }
    },
    "relatedResource": {
      "type": "array",
      "minItems": 1,
      "uniqueItems": true,
      "items": {
        "type": "object",
        "required": [
          "id",
          "digestSRI"
        ],
        "properties": {
          "id": {
            "type": "string",
            "format": "uri"
          },
          "digestSRI": {
            "type": "string",
            "pattern": "^sha384-[A-Za-z0-9+/]{64}$"
          }
        },
        "additionalProperties": false
      }
    },
    "credentialStatus": {
      "oneOf": [
        {
          "type": "object",
          "required": [
            "id",
            "type",
            "statusPurpose",
            "statusListIndex",
            "statusListCredential"
          ],
          "properties": {
            "id": {
              "type": "string",
              "format": "uri"
            },
            "type": {
              "const": "BitstringStatusListEntry"
            },
            "statusPurpose": {
              "enum": [
                "revocation",
                "suspension"
              ]
            },
            "statusListIndex": {
              "type": "string",
              "pattern": "^(0|[1-9][0-9]*)$"
            },
            "statusListCredential": {
              "type": "string",
              "format": "uri"
            }
          },
          "additionalProperties": false
        },
        {
          "type": "array",
          "minItems": 1,
          "maxItems": 2,
          "items": {
            "type": "object",
            "required": [
              "id",
              "type",
              "statusPurpose",
              "statusListIndex",
              "statusListCredential"
            ],
            "properties": {
              "id": {
                "type": "string",
                "format": "uri"
              },
              "type": {
                "const": "BitstringStatusListEntry"
              },
              "statusPurpose": {
                "enum": [
                  "revocation",
                  "suspension"
                ]
              },
              "statusListIndex": {
                "type": "string",
                "pattern": "^(0|[1-9][0-9]*)$"
              },
              "statusListCredential": {
                "type": "string",
                "format": "uri"
              }
            },
            "additionalProperties": false
          }
        }
      ]
    },
    "name": {
      "type": "string",
      "minLength": 1
    },
    "description": {
      "type": "string",
      "minLength": 1
    },
    "proof": {
      "type": "object",
      "required": [
        "type",
        "cryptosuite",
        "proofPurpose",
        "verificationMethod",
        "created",
        "proofValue"
      ],
      "properties": {
        "type": {
          "const": "DataIntegrityProof"
        },
        "cryptosuite": {
          "const": "eddsa-rdfc-2022"
        },
        "proofPurpose": {
          "const": "assertionMethod"
        },
        "verificationMethod": {
          "type": "string",
          "format": "uri"
        },
        "created": {
          "type": "string",
          "pattern": "^\\d{4}-\\d{2}-\\d{2}T\\d{2}:\\d{2}:\\d{2}(\\.\\d{1,9})?(Z|[+-]\\d{2}:\\d{2})$"
        },
        "proofValue": {
          "type": "string",
          "pattern": "^z[1-9A-HJ-NP-Za-km-z]+$"
        }
      },
      "additionalProperties": false
    }
  },
  "additionalProperties": false
}
