{
  "@context": [
    "https://www.w3.org/ns/credentials/v2",
    "https://vc4qi.example/contexts/rm/1"
  ],
  "id": "https://producer.vc4qi.example/credentials/D520",
  "type": [
    "VerifiableCredential",
    "RmCertificate"
  ],
  "issuer": "https://producer.vc4qi.example/controller",
  "validFrom": "2026-02-01T00:00:00Z",
  "validUntil": "2028-02-01T00:00:00Z",
  "credentialSchema": {
    "id": "https://vc4qi.example/schemas/rm/1/certificate.json",
    "type": "JsonSchema"
  },
  "name": "Reference material certificate, CuZn39Pb3 disc lot 1 (hypothetical reissue)",
  "credentialSubject": {
    "id": "urn:vc4qi-example:batch:cuzn39pb3-disc-lot-1",
    "activityTime": "2026-01-20T00:00:00Z",
    "materials": [
      {
        "matrixIri": "https://vc4qi.example/bindings/rm/1#CuZn39Pb3",
        "formIri": "https://vc4qi.example/bindings/rm/1#Disc",
        "name": "Fictional CuZn39Pb3 brass disc"
      }
    ],
    "materialPropertiesList": [
      {
        "isCertified": true,
        "results": [
          {
            "propertyIri": "https://vc4qi.example/bindings/rm/1#As",
            "methodIri": "https://vc4qi.example/bindings/rm/1#M1",
            "data": {
              "quantity": {
                "quantityKind": "https://vc4qi.example/bindings/rm/1#MassFraction",
                "value": "520",
                "unit": {
                  "ucumCode": "mg/kg"
                },
                "uncertainty": {
                  "expandedUncertainty": "5",
                  "coverageFactor": "2"
                }
              }
            }
          },
          {
            "propertyIri": "https://vc4qi.example/bindings/rm/1#Cu",
            "methodIri": "https://vc4qi.example/bindings/rm/1#M1",
            "data": {
              "quantity": {
                "quantityKind": "https://vc4qi.example/bindings/rm/1#MassFraction",
                "value": "57.68",
                "unit": {
                  "ucumCode": "%"
                },
                "uncertainty": {
                  "expandedUncertainty": "0.14",
                  "coverageFactor": "2"
                }
              }
            }
          },
          {
            "propertyIri": "https://vc4qi.example/bindings/rm/1#Zn",
            "methodIri": "https://vc4qi.example/bindings/rm/1#M1",
            "data": {
              "quantity": {
                "quantityKind": "https://vc4qi.example/bindings/rm/1#MassFraction",
                "value": "38.2",
                "unit": {
                  "ucumCode": "%"
                },
                "uncertainty": {
                  "expandedUncertainty": "0.4",
                  "coverageFactor": "2"
                }
              }
            }
          },
          {
            "propertyIri": "https://vc4qi.example/bindings/rm/1#Pb",
            "methodIri": "https://vc4qi.example/bindings/rm/1#M1",
            "data": {
              "quantity": {
                "quantityKind": "https://vc4qi.example/bindings/rm/1#MassFraction",
                "value": "3.07",
                "unit": {
                  "ucumCode": "%"
                },
                "uncertainty": {
                  "expandedUncertainty": "0.06",
                  "coverageFactor": "2"
                }
              }
            }
          }
        ]
      }
    ]
  },
  "termsOfUse": [
    {
      "type": "RmAuthorizationPolicy",
      "authorizationCredential": {
        "id": "https://producer.vc4qi.example/credentials/O",
        "type": "RmOperationalScope"
      }
    }
  ],
  "evidence": [
    {
      "id": "https://lab.vc4qi.example/credentials/S",
      "type": "RmStudyReference"
    }
  ],
  "relatedResource": [
    {
      "id": "https://producer.vc4qi.example/credentials/O",
      "digestSRI": "sha384-f3Evi/MQEbnrB+R7sFDOthCOZjSwIqB6N4YLknZkUgy7oTkHaC0tjqxdTCc2yntx"
    },
    {
      "id": "https://lab.vc4qi.example/credentials/S",
      "digestSRI": "sha384-Glb8JY0hsYDKG2QTysAC6EhgHcxj+iVzfWbywOEHL9x8nGV0H+A3hOwLcq+TAXRA"
    }
  ],
  "credentialStatus": {
    "id": "https://producer.vc4qi.example/status/1#3",
    "type": "BitstringStatusListEntry",
    "statusPurpose": "revocation",
    "statusListIndex": "3",
    "statusListCredential": "https://producer.vc4qi.example/status/1"
  },
  "proof": {
    "type": "DataIntegrityProof",
    "cryptosuite": "eddsa-rdfc-2022",
    "proofPurpose": "assertionMethod",
    "verificationMethod": "https://producer.vc4qi.example/controller#key-1",
    "created": "2026-02-01T00:00:00Z",
    "proofValue": "z5aQzY6AFTurJ1UWg9Gm6QEwPszf83D7pSgzeqAK7J25JG6zogEnqmH1hjrzxhFPayxsU8BNtu4McazuCRsWAFPR"
  }
}
